{
  "contract_version": "1.0.0",
  "package_id": "jewelai.validation.three_stone",
  "artifact_version": "1.0.0",
  "sources": [
    {
      "source_id": "SRC-THREE-STONE-VALIDATION",
      "title": "Reviewed three-stone validation evidence",
      "source_type": "PROFESSIONAL_EDUCATION",
      "uri": "https://www.gia.edu/",
      "language": "en",
      "evidence_tier": "PRIMARY",
      "lifecycle_status": "REVIEWED"
    },
    {
      "source_id": "DEC-THREE-STONE-POLICY",
      "title": "JewelAI three-stone validation policy",
      "source_type": "INTERNAL_DECISION",
      "language": "not_applicable",
      "evidence_tier": "INTERNAL",
      "lifecycle_status": "REVIEWED"
    }
  ],
  "claims": [
    {
      "claim_id": "CLM-THREE-STONE",
      "statement": "The validation slice models a ring with a center-stone role and side-stone roles without inferring material, dimensions, or cut.",
      "source_id": "SRC-THREE-STONE-VALIDATION",
      "supporting_source_ids": [],
      "evidence_strength": "MEDIUM",
      "scope": "three-stone architecture validation",
      "lifecycle_status": "REVIEWED"
    }
  ],
  "domain_knowledge": [
    {
      "concept_id": "style.three_stone",
      "kind": "style",
      "relationships": [],
      "claim_ids": ["CLM-THREE-STONE"],
      "structural_schema": false,
      "lifecycle_status": "REVIEWED"
    }
  ],
  "language_mappings": [
    {
      "mapping_id": "LANG-EN-THREE-STONE",
      "concept_id": "style.three_stone",
      "locale": "en",
      "canonical_term": "three-stone",
      "aliases": ["three stone"],
      "mapping_mode": "DIRECT",
      "mapping_quality": "PREFERRED",
      "lifecycle_status": "REVIEWED"
    },
    {
      "mapping_id": "LANG-RU-THREE-STONE",
      "concept_id": "style.three_stone",
      "locale": "ru",
      "canonical_term": "кольцо с тремя камнями",
      "aliases": ["трехкаменное кольцо", "трёхкаменное кольцо"],
      "mapping_mode": "DIRECT",
      "mapping_quality": "PREFERRED",
      "lifecycle_status": "REVIEWED"
    }
  ],
  "policies": [
    {
      "policy_id": "POL-THREE-STONE-SIDE-SHAPE",
      "target": "side_stones.{group_id}.stones.shape",
      "effect": "Bind side-stone shape enrichment only to an existing stable group_id and never create a side-stone group.",
      "source_kind": "INTERNAL_PRODUCT_DECISION",
      "source_refs": ["DEC-THREE-STONE-POLICY"],
      "lifecycle_status": "REVIEWED"
    }
  ]
}
